{
  "schemaVersion": "1.0",
  "ruleVersion": "1",
  "rendererVersion": "1",
  "extractionVersion": "none",
  "terminologyVersion": "uncoded-1",
  "templateKey": "obgyn.prenatal.initial",
  "title": "Prenatal \u00b7 initial",
  "specialty": "OB_GYN",
  "encounterType": "PRENATAL_INITIAL",
  "businessVersion": "1.0.0",
  "requiresPregnancyEpisode": true,
  "syntheticOnly": true,
  "sections": [
    {
      "id": "31624f98-b956-512d-8b61-98e1258606f5",
      "key": "reason-section",
      "label": "Reason & history",
      "fields": [
        {
          "id": "4a980d8f-8550-502d-ab2c-0c94c0c13be1",
          "key": "visit.reason",
          "concept": "visit.reason",
          "label": "Reason for visit",
          "type": "MULTILINE_TEXT",
          "options": [],
          "units": [],
          "allowedMissingStates": [
            "NOT_ASSESSED",
            "UNKNOWN",
            "DECLINED",
            "NOT_APPLICABLE"
          ],
          "maxLength": 4000,
          "maxItems": 0,
          "precision": 2,
          "requiredAtSign": true,
          "sensitivity": "CLINICAL",
          "visibleWhen": null,
          "requiredWhen": null,
          "fields": []
        },
        {
          "id": "d9b61b46-38b1-502a-8774-1a6ca56e72b8",
          "key": "visit.history",
          "concept": "visit.history",
          "label": "History reported today",
          "type": "MULTILINE_TEXT",
          "options": [],
          "units": [],
          "allowedMissingStates": [
            "NOT_ASSESSED",
            "UNKNOWN",
            "DECLINED",
            "NOT_APPLICABLE"
          ],
          "maxLength": 4000,
          "maxItems": 0,
          "precision": 2,
          "requiredAtSign": false,
          "sensitivity": "CLINICAL",
          "visibleWhen": null,
          "requiredWhen": null,
          "fields": []
        }
      ]
    },
    {
      "id": "7160f480-e5c0-5a0a-b1dc-9b44bde297d8",
      "key": "prenatal-section",
      "label": "Pregnancy review",
      "fields": [
        {
          "id": "445e5b8a-b7d0-503d-a3d5-a49c82fbf140",
          "key": "pregnancy.concerns",
          "concept": "pregnancy.concerns",
          "label": "New concerns discussed",
          "type": "SINGLE_CHOICE",
          "options": [
            "PRESENT",
            "NONE_REPORTED"
          ],
          "units": [],
          "allowedMissingStates": [
            "NOT_ASSESSED",
            "UNKNOWN",
            "DECLINED",
            "NOT_APPLICABLE"
          ],
          "maxLength": 4000,
          "maxItems": 0,
          "precision": 2,
          "requiredAtSign": false,
          "sensitivity": "RESTRICTED_REPRODUCTIVE",
          "visibleWhen": null,
          "requiredWhen": null,
          "fields": []
        },
        {
          "id": "8829ec70-5597-52c7-a848-9cd74c0d39a8",
          "key": "pregnancy.concernDetails",
          "concept": "pregnancy.concernDetails",
          "label": "Concern details",
          "type": "MULTILINE_TEXT",
          "options": [],
          "units": [],
          "allowedMissingStates": [
            "NOT_ASSESSED",
            "UNKNOWN",
            "DECLINED",
            "NOT_APPLICABLE"
          ],
          "maxLength": 4000,
          "maxItems": 0,
          "precision": 2,
          "requiredAtSign": false,
          "sensitivity": "RESTRICTED_REPRODUCTIVE",
          "visibleWhen": {
            "op": "EQ",
            "fieldId": "445e5b8a-b7d0-503d-a3d5-a49c82fbf140",
            "values": [
              "PRESENT"
            ],
            "rules": []
          },
          "requiredWhen": {
            "op": "EQ",
            "fieldId": "445e5b8a-b7d0-503d-a3d5-a49c82fbf140",
            "values": [
              "PRESENT"
            ],
            "rules": []
          },
          "fields": []
        },
        {
          "id": "bdb16da7-d4a9-5523-92c9-145479c0d9bc",
          "key": "pregnancy.maternalWeight",
          "concept": "pregnancy.maternalWeight",
          "label": "Weight recorded today",
          "type": "QUANTITY",
          "options": [],
          "units": [
            "kg"
          ],
          "allowedMissingStates": [
            "NOT_ASSESSED",
            "UNKNOWN",
            "DECLINED",
            "NOT_APPLICABLE"
          ],
          "maxLength": 4000,
          "maxItems": 0,
          "precision": 2,
          "requiredAtSign": false,
          "sensitivity": "RESTRICTED_REPRODUCTIVE",
          "visibleWhen": null,
          "requiredWhen": null,
          "fields": []
        },
        {
          "id": "25dd4f31-b3f6-5f31-9490-3f608ca8afa0",
          "key": "pregnancy.priorAccounts",
          "concept": "pregnancy.priorAccounts",
          "label": "Prior pregnancy accounts",
          "type": "GROUP",
          "options": [],
          "units": [],
          "allowedMissingStates": [
            "NOT_ASSESSED",
            "UNKNOWN",
            "DECLINED",
            "NOT_APPLICABLE"
          ],
          "maxLength": 4000,
          "maxItems": 20,
          "precision": 2,
          "requiredAtSign": false,
          "sensitivity": "RESTRICTED_REPRODUCTIVE",
          "visibleWhen": null,
          "requiredWhen": null,
          "fields": [
            {
              "id": "212b2e83-cc5a-5455-9b43-f18bfd16bc79",
              "key": "pregnancy.priorAccount",
              "concept": "pregnancy.priorAccount",
              "label": "Reported history",
              "type": "MULTILINE_TEXT",
              "options": [],
              "units": [],
              "allowedMissingStates": [
                "NOT_ASSESSED",
                "UNKNOWN",
                "DECLINED",
                "NOT_APPLICABLE"
              ],
              "maxLength": 4000,
              "maxItems": 0,
              "precision": 2,
              "requiredAtSign": false,
              "sensitivity": "RESTRICTED_REPRODUCTIVE",
              "visibleWhen": null,
              "requiredWhen": null,
              "fields": []
            },
            {
              "id": "c8905591-c8dc-51dd-8c9e-3c5435bf4c7a",
              "key": "pregnancy.priorDate",
              "concept": "pregnancy.priorDate",
              "label": "Reported date",
              "type": "DATE",
              "options": [],
              "units": [],
              "allowedMissingStates": [
                "NOT_ASSESSED",
                "UNKNOWN",
                "DECLINED",
                "NOT_APPLICABLE"
              ],
              "maxLength": 4000,
              "maxItems": 0,
              "precision": 2,
              "requiredAtSign": false,
              "sensitivity": "RESTRICTED_REPRODUCTIVE",
              "visibleWhen": null,
              "requiredWhen": null,
              "fields": []
            }
          ]
        }
      ]
    },
    {
      "id": "da71db2b-9099-5025-a744-8ce343b7f1c2",
      "key": "assessment-section",
      "label": "Assessment & plan",
      "fields": [
        {
          "id": "86e3893f-752d-5354-9b50-022e4cbdcfb2",
          "key": "visit.assessment",
          "concept": "visit.assessment",
          "label": "Clinical assessment",
          "type": "MULTILINE_TEXT",
          "options": [],
          "units": [],
          "allowedMissingStates": [
            "NOT_ASSESSED",
            "UNKNOWN",
            "DECLINED",
            "NOT_APPLICABLE"
          ],
          "maxLength": 4000,
          "maxItems": 0,
          "precision": 2,
          "requiredAtSign": true,
          "sensitivity": "CLINICAL",
          "visibleWhen": null,
          "requiredWhen": null,
          "fields": []
        },
        {
          "id": "1d600c98-ca61-5e19-acd0-4b25c31e87eb",
          "key": "visit.plan",
          "concept": "visit.plan",
          "label": "Plan & counselling",
          "type": "MULTILINE_TEXT",
          "options": [],
          "units": [],
          "allowedMissingStates": [
            "NOT_ASSESSED",
            "UNKNOWN",
            "DECLINED",
            "NOT_APPLICABLE"
          ],
          "maxLength": 4000,
          "maxItems": 0,
          "precision": 2,
          "requiredAtSign": true,
          "sensitivity": "CLINICAL",
          "visibleWhen": null,
          "requiredWhen": null,
          "fields": []
        },
        {
          "id": "73fca15c-05d9-562e-9fa0-4c590b29f129",
          "key": "visit.disposition",
          "concept": "visit.disposition",
          "label": "Disposition & follow-up",
          "type": "MULTILINE_TEXT",
          "options": [],
          "units": [],
          "allowedMissingStates": [
            "NOT_ASSESSED",
            "UNKNOWN",
            "DECLINED",
            "NOT_APPLICABLE"
          ],
          "maxLength": 4000,
          "maxItems": 0,
          "precision": 2,
          "requiredAtSign": true,
          "sensitivity": "CLINICAL",
          "visibleWhen": null,
          "requiredWhen": null,
          "fields": []
        }
      ]
    }
  ]
}
