{
  "schemaVersion": "1.0",
  "ruleVersion": "1",
  "rendererVersion": "1",
  "extractionVersion": "none",
  "terminologyVersion": "uncoded-1",
  "templateKey": "obgyn.postpartum.followup",
  "title": "Postpartum \u00b7 follow-up",
  "specialty": "OB_GYN",
  "encounterType": "POSTPARTUM_FOLLOWUP",
  "businessVersion": "1.0.0",
  "requiresPregnancyEpisode": true,
  "syntheticOnly": true,
  "sections": [
    {
      "id": "31624f98-b956-512d-8b61-98e1258606f5",
      "key": "reason-section",
      "label": "Reason & history",
      "fields": [
        {
          "id": "4a980d8f-8550-502d-ab2c-0c94c0c13be1",
          "key": "visit.reason",
          "concept": "visit.reason",
          "label": "Reason for visit",
          "type": "MULTILINE_TEXT",
          "options": [],
          "units": [],
          "allowedMissingStates": [
            "NOT_ASSESSED",
            "UNKNOWN",
            "DECLINED",
            "NOT_APPLICABLE"
          ],
          "maxLength": 4000,
          "maxItems": 0,
          "precision": 2,
          "requiredAtSign": true,
          "sensitivity": "CLINICAL",
          "visibleWhen": null,
          "requiredWhen": null,
          "fields": []
        },
        {
          "id": "d9b61b46-38b1-502a-8774-1a6ca56e72b8",
          "key": "visit.history",
          "concept": "visit.history",
          "label": "History reported today",
          "type": "MULTILINE_TEXT",
          "options": [],
          "units": [],
          "allowedMissingStates": [
            "NOT_ASSESSED",
            "UNKNOWN",
            "DECLINED",
            "NOT_APPLICABLE"
          ],
          "maxLength": 4000,
          "maxItems": 0,
          "precision": 2,
          "requiredAtSign": false,
          "sensitivity": "CLINICAL",
          "visibleWhen": null,
          "requiredWhen": null,
          "fields": []
        }
      ]
    },
    {
      "id": "d371c411-3a3a-51c8-9917-90497b37fc11",
      "key": "postpartum-section",
      "label": "Postpartum review",
      "fields": [
        {
          "id": "6630e4c1-80bc-5ba8-a751-2f10623dd7e6",
          "key": "postpartum.outcome",
          "concept": "postpartum.outcome",
          "label": "Sourced pregnancy / outcome account",
          "type": "MULTILINE_TEXT",
          "options": [],
          "units": [],
          "allowedMissingStates": [
            "NOT_ASSESSED",
            "UNKNOWN",
            "DECLINED",
            "NOT_APPLICABLE"
          ],
          "maxLength": 4000,
          "maxItems": 0,
          "precision": 2,
          "requiredAtSign": false,
          "sensitivity": "RESTRICTED_REPRODUCTIVE",
          "visibleWhen": null,
          "requiredWhen": null,
          "fields": []
        },
        {
          "id": "b2922667-c38c-5e51-a07f-82657286b380",
          "key": "postpartum.recovery",
          "concept": "postpartum.recovery",
          "label": "Recovery and concerns as assessed",
          "type": "MULTILINE_TEXT",
          "options": [],
          "units": [],
          "allowedMissingStates": [
            "NOT_ASSESSED",
            "UNKNOWN",
            "DECLINED",
            "NOT_APPLICABLE"
          ],
          "maxLength": 4000,
          "maxItems": 0,
          "precision": 2,
          "requiredAtSign": false,
          "sensitivity": "RESTRICTED_REPRODUCTIVE",
          "visibleWhen": null,
          "requiredWhen": null,
          "fields": []
        }
      ]
    },
    {
      "id": "da71db2b-9099-5025-a744-8ce343b7f1c2",
      "key": "assessment-section",
      "label": "Assessment & plan",
      "fields": [
        {
          "id": "86e3893f-752d-5354-9b50-022e4cbdcfb2",
          "key": "visit.assessment",
          "concept": "visit.assessment",
          "label": "Clinical assessment",
          "type": "MULTILINE_TEXT",
          "options": [],
          "units": [],
          "allowedMissingStates": [
            "NOT_ASSESSED",
            "UNKNOWN",
            "DECLINED",
            "NOT_APPLICABLE"
          ],
          "maxLength": 4000,
          "maxItems": 0,
          "precision": 2,
          "requiredAtSign": true,
          "sensitivity": "CLINICAL",
          "visibleWhen": null,
          "requiredWhen": null,
          "fields": []
        },
        {
          "id": "1d600c98-ca61-5e19-acd0-4b25c31e87eb",
          "key": "visit.plan",
          "concept": "visit.plan",
          "label": "Plan & counselling",
          "type": "MULTILINE_TEXT",
          "options": [],
          "units": [],
          "allowedMissingStates": [
            "NOT_ASSESSED",
            "UNKNOWN",
            "DECLINED",
            "NOT_APPLICABLE"
          ],
          "maxLength": 4000,
          "maxItems": 0,
          "precision": 2,
          "requiredAtSign": true,
          "sensitivity": "CLINICAL",
          "visibleWhen": null,
          "requiredWhen": null,
          "fields": []
        },
        {
          "id": "73fca15c-05d9-562e-9fa0-4c590b29f129",
          "key": "visit.disposition",
          "concept": "visit.disposition",
          "label": "Disposition & follow-up",
          "type": "MULTILINE_TEXT",
          "options": [],
          "units": [],
          "allowedMissingStates": [
            "NOT_ASSESSED",
            "UNKNOWN",
            "DECLINED",
            "NOT_APPLICABLE"
          ],
          "maxLength": 4000,
          "maxItems": 0,
          "precision": 2,
          "requiredAtSign": true,
          "sensitivity": "CLINICAL",
          "visibleWhen": null,
          "requiredWhen": null,
          "fields": []
        }
      ]
    }
  ]
}
